Question ID,Category,Tag 1,Tag 2,Tag 3,Tag 4,Tag 5,Tag 6,Tag 7,Tag 8,Tag 9
29315be2-e36d-4653-ad95-ebb0675fa39b,Physical Presence and Sensory Experience,AI's inability to provide physical intimacy or affection,"Importance of body language, facial expressions, and sensory cues",Lack of physical presence and touch,,,,,,
29315be2-e36d-4653-ad95-ebb0675fa39b,"Support, Comfort, and Reciprocity",AI's role as a confidant or therapist,Emotional support and comfort from humans versus AI,Mutual vulnerability and reciprocity in human relationships,Potential for AI to be more supportive or loyal,,,,,
29315be2-e36d-4653-ad95-ebb0675fa39b,"Trust, Privacy, and Ethical Concerns",Differences in accountability and responsibility,Trust and privacy concerns with AI versus humans,,,,,,,
29315be2-e36d-4653-ad95-ebb0675fa39b,Uncategorized,Other,,,,,,,,
29315be2-e36d-4653-ad95-ebb0675fa39b,,Uninformative answer,,,,,,,,
