Category,Tag 1,Tag 2,Tag 3,Tag 4,Tag 5,Tag 6,Tag 7
Changes in human connection and social skills,"Decline in empathy, social skills, and communication abilities",Loss of genuine human connection and social isolation,Loss of trust and authenticity in relationships,Reduction in face-to-face and real-life human interactions,,,
Cultural and societal transformation,Decline in marriage and birth rates,"Echo chambers, bias reinforcement, and reduced exposure to diverse views","Erosion of community, family, and societal bonds",Erosion of cultural values and traditions,"Loss of critical thinking, creativity, and independent decision-making",,
Economic and labor market impacts,"Job loss, economic disruption, and changes in labor markets",Potential for increased productivity and efficiency,,,,,
Impacts on children and vulnerable groups,Impact on children’s social development and education,Positive impacts for the elderly and people with disabilities,,,,,
Inequality and accessibility,Accessibility and inclusion for marginalized or isolated groups,Widening social and economic inequalities,,,,,
Mental health and emotional well-being,AI as a tool for accessible therapy and mental health care,Increased loneliness and individualism,Mental health impacts: both improved support and increased issues,Overdependence on AI for emotional support and companionship,Potential for improved conflict resolution,Potential for increased self-awareness and personal growth,Risks of addiction or obsession with AI companions
"Privacy, security, and manipulation risks","Manipulation, exploitation, and emotional vulnerability",Privacy concerns and data security risks,,,,,
Shifts in relationship norms and intimacy,AI as a mediator or advisor in relationships,Blurring boundaries between human and AI relationships,Societal transformation and redefinition of intimacy,Unrealistic expectations and distorted relationship norms,,,
Uncategorized,Other,,,,,,
,Uninformative answer,,,,,,
